{
  "uots_version": "1.0.0",
  "observability": {
    "name": "Grafana Neo4j Dashboard",
    "type": "grafana_dashboard",
    "tags": [
      "grafana",
      "neo4j",
      "dashboard"
    ]
  },
  "target": {
    "file": "deploy/docker/grafana/dashboards/mdemg-neo4j.json"
  },
  "expected": {
    "dashboard": {
      "uid": "mdemg-neo4j",
      "title": "MDEMG Neo4j Graph",
      "panel_count_min": 12,
      "required_panel_titles": [
        "Total Nodes",
        "Total Edges",
        "Total Spaces",
        "Neo4j Pool Active",
        "Neo4j Memory",
        "Neo4j Container CPU Usage",
        "Neo4j Container Memory Usage",
        "Space Overview",
        "Health Score Over Time",
        "Orphan Nodes",
        "Neo4j Connection Pool",
        "Hebbian Co-Activation Edges"
      ],
      "required_queries": [
        "mdemg_neo4j_graph_total_nodes",
        "mdemg_neo4j_graph_total_edges",
        "mdemg_neo4j_pool_active_connections",
        "mdemg_neo4j_pool_idle_connections",
        "mdemg_neo4j_pool_waiting_requests",
        "mdemg_neo4j_container_cpu_percent",
        "mdemg_neo4j_container_mem_used_bytes",
        "mdemg_rsic_health_overall",
        "mdemg_circuit_breaker_state"
      ],
      "required_template_vars": [
        "instance",
        "space_id"
      ],
      "tags": [
        "mdemg",
        "neo4j",
        "graph"
      ]
    }
  },
  "config": {
    "timeout_ms": 5000
  },
  "metadata": {
    "author": "claude",
    "created": "2026-02-16",
    "updated": "2026-06-11",
    "description": "Validates the Grafana Neo4j dashboard JSON structure: correct UID, title, required panels and metric queries. Refreshed in UXTS-CI-001 to the post-GRAFANA-AUDIT-001 dashboard truth (panels renamed: Heap Memory→Neo4j Memory, Orphans Per Space Over Time→Orphan Nodes, Learning Edges Over Time→Hebbian Co-Activation Edges; per-space mdemg_neo4j_graph_* metric queries moved out of this dashboard) — the stale spec was invisible while the UOTS step was a continue-on-error zombie.",
    "status": "active",
    "tags": [
      "grafana",
      "neo4j",
      "phase-grafana"
    ]
  }
}